Course Name,Grade (on a 4.0 scale),Major,Skills (comma-separated if multiple),Skills List
Digital Marketing,3.5,Marketing,"social media platforms, content creation, advertising",
Web Development,3.7,Computer Science,"html, css, javascript, frontend frameworks",
Quality Control,3.6,Operations Management,"quality control, process improvement, safety standards",
Wireless Networks,3.8,Network Engineering,"wi-fi, wireless design, network optimization",
Sql Databases,3.9,Computer Applications,"sql, database design, data management",
